{
  "contract": "io.clayz.presentation.composition-pattern-resolution/1.0",
  "resolution_id": "pattern-resolution-a34d4fcb963270a90ade",
  "request": {
    "contract": "io.clayz.presentation.composition-pattern-request/1.0",
    "request_id": "stage4-synthetic-unregistered",
    "task_mode": "new-build",
    "page_role": "orbital-constellation",
    "semantic_relations": [
      "orbits"
    ],
    "purpose_tags": [
      "unregistered"
    ],
    "language": "zh-CN",
    "rights_context": "public-open-source",
    "provider_ids": [
      "builtin-catalog"
    ],
    "constraints": [
      "do not invent an orbital pattern"
    ],
    "expected_visual_effect": "remain explicit when no registered pattern exists"
  },
  "status": "unresolved",
  "retrieval_receipt_ids": [
    "receipt-f92e96e6bcb68845b4cd"
  ],
  "selected_composition_pattern": null,
  "linked_failure_pattern_ids": [],
  "rejected_patterns": [],
  "fallback": {
    "used": true,
    "reason": "no-eligible-registered-composition-pattern",
    "next_action": "use-core-art-direction-without-claiming-a-pattern"
  },
  "guards": {
    "only_registered_records": true,
    "only_receipt_candidates_selected": true,
    "linked_failures_receipt_bound": true,
    "no_invented_patterns": true,
    "theme_not_selected_here": true,
    "visual_variant_not_selected_here": true,
    "layout_contract_not_selected_here": true,
    "coordinates_not_selected_here": true
  }
}

